DROP DATABASE IF EXISTS testdb3;
CREATE DATABASE testdb3 WITH LC_COLLATE='C' LC_CTYPE='C' TEMPLATE=template0;
\c testdb3
CREATE TABLE hi_안녕세계 (a int, 안녕세계1 text, 안녕세계2 text, 안녕세계3 text) DISTRIBUTED BY (a);
-- DROP/ADD/RENAME columns
ALTER TABLE hi_안녕세계 DROP COLUMN 안녕세계2;
ALTER TABLE hi_안녕세계 ADD COLUMN 안녕세계2_ADD_COLUMN text;
ALTER TABLE hi_안녕세계 RENAME COLUMN 안녕세계3 TO 안녕세계3_RENAME;
INSERT INTO hi_안녕세계 VALUES(1, '안녕세계1 first', '안녕세2 first', '안녕세계3 first');
INSERT INTO hi_안녕세계 VALUES(42, '안녕세계1 second', '안녕세2 second', '안녕세계3 second');
SET optimizer_trace_fallback=on;
-- DELETE
EXPLAIN DELETE FROM hi_안녕세계 WHERE a=42;
                              QUERY PLAN                              
----------------------------------------------------------------------
 Delete on "hi_안녕세계"  (cost=0.00..431.05 rows=1 width=1)
   ->  Seq Scan on "hi_안녕세계"  (cost=0.00..431.00 rows=1 width=38)
         Filter: (a = 42)
 Optimizer: GPORCA
(4 rows)

DELETE FROM hi_안녕세계 WHERE a=42;
-- UPDATE
EXPLAIN UPDATE hi_안녕세계 SET 안녕세계1='안녕세계1 first UPDATE' WHERE 안녕세계1='안녕세계1 first';
                              QUERY PLAN                              
----------------------------------------------------------------------
 Update on "hi_안녕세계"  (cost=0.00..431.05 rows=1 width=1)
   ->  Seq Scan on "hi_안녕세계"  (cost=0.00..431.00 rows=1 width=30)
         Filter: ("안녕세계1" = '안녕세계1 first'::text)
 Optimizer: GPORCA
(4 rows)

UPDATE hi_안녕세계 SET 안녕세계1='안녕세계1 first UPDATE' WHERE 안녕세계1='안녕세계1 first';
-- SELECT
EXPLAIN SELECT * FROM hi_안녕세계;
                                  QUERY PLAN                                   
-------------------------------------------------------------------------------
 Gather Motion 3:1  (slice1; segments: 3)  (cost=0.00..431.00 rows=1 width=28)
   ->  Seq Scan on "hi_안녕세계"  (cost=0.00..431.00 rows=1 width=28)
 Optimizer: GPORCA
(3 rows)

SELECT * FROM hi_안녕세계;
 a |       안녕세계1        | 안녕세계3_rename | 안녕세계2_add_column 
---+------------------------+------------------+----------------------
 1 | 안녕세계1 first UPDATE | 안녕세2 first    | 안녕세계3 first
(1 row)

-- SELECT ALIAS
EXPLAIN SELECT 안녕세계1 AS 안녕세계1_Alias FROM hi_안녕세계;
                                  QUERY PLAN                                  
------------------------------------------------------------------------------
 Gather Motion 3:1  (slice1; segments: 3)  (cost=0.00..431.00 rows=1 width=8)
   ->  Seq Scan on "hi_안녕세계"  (cost=0.00..431.00 rows=1 width=8)
 Optimizer: GPORCA
(3 rows)

SELECT 안녕세계1 AS 안녕세계1_Alias FROM hi_안녕세계;
    안녕세계1_alias     
------------------------
 안녕세계1 first UPDATE
(1 row)

-- SUBQUERY
EXPLAIN SELECT * FROM (SELECT 안녕세계1 FROM hi_안녕세계) t;
                                  QUERY PLAN                                  
------------------------------------------------------------------------------
 Gather Motion 3:1  (slice1; segments: 3)  (cost=0.00..431.00 rows=1 width=8)
   ->  Seq Scan on "hi_안녕세계"  (cost=0.00..431.00 rows=1 width=8)
 Optimizer: GPORCA
(3 rows)

SELECT * FROM (SELECT 안녕세계1 FROM hi_안녕세계) t;
       안녕세계1        
------------------------
 안녕세계1 first UPDATE
(1 row)

-- CTE
EXPLAIN WITH cte AS
(SELECT 안녕세계1, 안녕세계2_ADD_COLUMN FROM hi_안녕세계) SELECT * FROM cte WHERE 안녕세계1 LIKE '안녕세계1%';
                                  QUERY PLAN                                   
-------------------------------------------------------------------------------
 Gather Motion 3:1  (slice1; segments: 3)  (cost=0.00..431.00 rows=1 width=16)
   ->  Seq Scan on "hi_안녕세계"  (cost=0.00..431.00 rows=1 width=16)
         Filter: ("안녕세계1" ~~ '안녕세계1%'::text)
 Optimizer: GPORCA
(4 rows)

WITH cte AS
(SELECT 안녕세계1, 안녕세계2_ADD_COLUMN FROM hi_안녕세계) SELECT * FROM cte WHERE 안녕세계1 LIKE '안녕세계1%';
       안녕세계1        | 안녕세계2_add_column 
------------------------+----------------------
 안녕세계1 first UPDATE | 안녕세계3 first
(1 row)

-- JOIN
EXPLAIN SELECT * FROM hi_안녕세계 hi_안녕세계1, hi_안녕세계 hi_안녕세계2 WHERE hi_안녕세계1.안녕세계1 LIKE '%UPDATE';
                                            QUERY PLAN                                            
--------------------------------------------------------------------------------------------------
 Gather Motion 3:1  (slice1; segments: 3)  (cost=0.00..1324032.69 rows=1 width=56)
   ->  Nested Loop  (cost=0.00..1324032.69 rows=1 width=56)
         Join Filter: true
         ->  Broadcast Motion 3:3  (slice2; segments: 3)  (cost=0.00..431.00 rows=1 width=28)
               ->  Seq Scan on "hi_안녕세계" "hi_안녕세계_1"  (cost=0.00..431.00 rows=1 width=28)
                     Filter: ("안녕세계1" ~~ '%UPDATE'::text)
         ->  Seq Scan on "hi_안녕세계"  (cost=0.00..431.00 rows=1 width=28)
 Optimizer: GPORCA
(8 rows)

SELECT * FROM hi_안녕세계 hi_안녕세계1, hi_안녕세계 hi_안녕세계2 WHERE hi_안녕세계1.안녕세계1 LIKE '%UPDATE';
 a |       안녕세계1        | 안녕세계3_rename | 안녕세계2_add_column | a |       안녕세계1        | 안녕세계3_rename | 안녕세계2_add_column 
---+------------------------+------------------+----------------------+---+------------------------+------------------+----------------------
 1 | 안녕세계1 first UPDATE | 안녕세2 first    | 안녕세계3 first      | 1 | 안녕세계1 first UPDATE | 안녕세2 first    | 안녕세계3 first
(1 row)

